{
  "control_catalog_sha256": "70bbd955a65969d2843b60220ad0aad2850f36ec6d189ecd32c40431b848b398",
  "controls": [
    {
      "id": "AGT-100",
      "path": "AGT/AGT-100.md",
      "record_sha256": "fb0aa79a400fd730ac4fa505e0364889442bbf8b9803dfdec41dc741ffe9c54c",
      "status": "draft",
      "version": "0.1.0"
    },
    {
      "id": "AGT-110",
      "path": "AGT/AGT-110.md",
      "record_sha256": "11caad08dcd99bf10a89f3b4c661beb00c37075548fcd2fb5c9aad3903ffd999",
      "status": "draft",
      "version": "0.1.0"
    },
    {
      "id": "AGT-120",
      "path": "AGT/AGT-120.md",
      "record_sha256": "3eb4ff1496add00c13c17d1307dcb8aae86dac0b4412cc9b60ec1de1f00711c5",
      "status": "draft",
      "version": "0.1.0"
    },
    {
      "id": "AGT-130",
      "path": "AGT/AGT-130.md",
      "record_sha256": "bcf21dd0adb607d163c052599b7c2407df807335872d5048c96ecde6f4e94bd4",
      "status": "draft",
      "version": "0.1.0"
    },
    {
      "id": "AGT-140",
      "path": "AGT/AGT-140.md",
      "record_sha256": "5d4bb436206f5b0a4ad5c55d46e7e740ecead56b2c6be97f44055c937ce688b4",
      "status": "draft",
      "version": "0.1.0"
    },
    {
      "id": "AGT-150",
      "path": "AGT/AGT-150.md",
      "record_sha256": "69496e76b1d9e429b4bdf9ea1060aa6e97be3740543059cd58893c921c2e11b1",
      "status": "draft",
      "version": "0.1.0"
    },
    {
      "id": "AGT-160",
      "path": "AGT/AGT-160.md",
      "record_sha256": "06d651b3ce2e4e1661aebbc5b379b43348759ba46942ff9285bf6ba9a9406318",
      "status": "draft",
      "version": "0.1.0"
    },
    {
      "id": "API-100",
      "path": "API/API-100.md",
      "record_sha256": "a38fed835e3aeb8c16ff9e7a86238b93d9a2d1abd1909bef8067084edc75f8fc",
      "status": "draft",
      "version": "0.1.0"
    },
    {
      "id": "API-110",
      "path": "API/API-110.md",
      "record_sha256": "1ddf08fea32ec70f42ceb4b7382c3073d19cc825c8a28bd2d100e87130126910",
      "status": "draft",
      "version": "0.1.0"
    },
    {
      "id": "API-120",
      "path": "API/API-120.md",
      "record_sha256": "ad2dffe0d8f0dc70f20cacbe437401a23f6610a3215f6d1936a8120a3fbefe67",
      "status": "draft",
      "version": "0.1.0"
    },
    {
      "id": "API-130",
      "path": "API/API-130.md",
      "record_sha256": "c6d0a5f23556a8344d614f8176698fe8a550282c13a02e51fef158eb96729d6f",
      "status": "draft",
      "version": "0.1.0"
    },
    {
      "id": "API-140",
      "path": "API/API-140.md",
      "record_sha256": "f4febd30a74451e4d7cf6de0cdd2a8f84a3c2b8918993abf0b26becfb36656b4",
      "status": "draft",
      "version": "0.1.0"
    },
    {
      "id": "API-150",
      "path": "API/API-150.md",
      "record_sha256": "44ed812e5ad14b57dacf50bb14ca8e476e1200d56095b0d0238bf1cb413c629b",
      "status": "draft",
      "version": "0.1.0"
    },
    {
      "id": "APP-100",
      "path": "APP/APP-100.md",
      "record_sha256": "eff2cd9fa98990ad72cdff3598f68bf777c65707fc1e39db24743e59a749a30d",
      "status": "draft",
      "version": "0.1.0"
    },
    {
      "id": "APP-110",
      "path": "APP/APP-110.md",
      "record_sha256": "8d42fb741e74812639d1639e0c5dd815743cf04a4c29d3f91f59bb3c44d9488b",
      "status": "draft",
      "version": "0.1.0"
    },
    {
      "id": "APP-120",
      "path": "APP/APP-120.md",
      "record_sha256": "952198fb2b528b3c91d466ef8c17723fee536d288f799d0e2645c1a43b4a3128",
      "status": "draft",
      "version": "0.1.0"
    },
    {
      "id": "APP-130",
      "path": "APP/APP-130.md",
      "record_sha256": "e95e37c2891082233c41dc6a38dfce426874f6539cc2af39c00c135f65ce43d0",
      "status": "draft",
      "version": "0.1.0"
    },
    {
      "id": "APP-140",
      "path": "APP/APP-140.md",
      "record_sha256": "0be56c65c19f5e64236b629fc4e3c2d0ec1f02809a84cb30f1f30706ac40015f",
      "status": "draft",
      "version": "0.1.0"
    },
    {
      "id": "APP-150",
      "path": "APP/APP-150.md",
      "record_sha256": "6bf36d1cca704c06238dd2fc0b2f51b6d1e884ab3b94c3d1a87f0ec5d13d8f77",
      "status": "draft",
      "version": "0.1.0"
    },
    {
      "id": "ARC-100",
      "path": "ARC/ARC-100.md",
      "record_sha256": "710f4726e889f6f52d6d0067c1ec0dd2ff3d9ead2ba78bd5a6caeaf531dd9f78",
      "status": "draft",
      "version": "0.1.0"
    },
    {
      "id": "ARC-110",
      "path": "ARC/ARC-110.md",
      "record_sha256": "aa2a809513a34d2b450c7573e63ae97392a1ac7418e23a3099bb04040f500d54",
      "status": "draft",
      "version": "0.1.0"
    },
    {
      "id": "ARC-120",
      "path": "ARC/ARC-120.md",
      "record_sha256": "4caf2dc262dd52348799147e505cfc41b2914c50c1d7184632f900f498bf34f0",
      "status": "draft",
      "version": "0.1.0"
    },
    {
      "id": "ARC-130",
      "path": "ARC/ARC-130.md",
      "record_sha256": "aa28e7b291851325d035a53ea1131fe0564633949ae88784781d87588d472229",
      "status": "draft",
      "version": "0.1.0"
    },
    {
      "id": "ARC-140",
      "path": "ARC/ARC-140.md",
      "record_sha256": "34dd0f9c1c53daa437823e38776b2545017dda666a552ed85022121411b56abe",
      "status": "draft",
      "version": "0.1.0"
    },
    {
      "id": "ARC-150",
      "path": "ARC/ARC-150.md",
      "record_sha256": "a96d889cb7dd15c97ba6a317dd5842b5ebab8b30b1509a014ddb4888d2ee4e37",
      "status": "draft",
      "version": "0.1.0"
    },
    {
      "id": "AUD-100",
      "path": "AUD/AUD-100.md",
      "record_sha256": "02a23413053521df7a61effe643a965365a20b59caf86d2ef5e0c91d9584d822",
      "status": "draft",
      "version": "0.1.0"
    },
    {
      "id": "AUD-110",
      "path": "AUD/AUD-110.md",
      "record_sha256": "cc8f4da58e63acf78d05276e8fc5e149715ab851e23cd2ae6b70da08f4d8d20e",
      "status": "draft",
      "version": "0.1.0"
    },
    {
      "id": "AUD-120",
      "path": "AUD/AUD-120.md",
      "record_sha256": "f6aa7dda8b73ee22586eb9728e59d5ec19f357a5c10187cd6c6a1d2c28f34ac0",
      "status": "draft",
      "version": "0.1.0"
    },
    {
      "id": "AUD-130",
      "path": "AUD/AUD-130.md",
      "record_sha256": "cecd8e3e917827670267476d7c35d15b46a51eca4878eff2b5d13f7cdf13eca5",
      "status": "draft",
      "version": "0.1.0"
    },
    {
      "id": "AUD-140",
      "path": "AUD/AUD-140.md",
      "record_sha256": "508ce6864aea3de80fb6f4ed139a9206fb7a571743cab258bebabff40a54dfd6",
      "status": "draft",
      "version": "0.1.0"
    },
    {
      "id": "CMP-100",
      "path": "CMP/CMP-100.md",
      "record_sha256": "7d30e4ab2337559b736ac2182ffe85cc62fe093681c5bd71e5735bb90b58d34b",
      "status": "draft",
      "version": "0.1.0"
    },
    {
      "id": "CMP-110",
      "path": "CMP/CMP-110.md",
      "record_sha256": "b02bad69b329e16ff1ac0becf9ff7eddfe9a0cdf6033f43045b03359a1aeed68",
      "status": "draft",
      "version": "0.1.0"
    },
    {
      "id": "CMP-120",
      "path": "CMP/CMP-120.md",
      "record_sha256": "094139d02ee8bc054943a7d2c1e291da59b204e2de9d5769639d5364bc488429",
      "status": "draft",
      "version": "0.1.0"
    },
    {
      "id": "CMP-130",
      "path": "CMP/CMP-130.md",
      "record_sha256": "3cac0de1b15502fcbe318c99cafb606e4a02cd4a03aa0b445cffba2c9656eff8",
      "status": "draft",
      "version": "0.1.0"
    },
    {
      "id": "CMP-140",
      "path": "CMP/CMP-140.md",
      "record_sha256": "fd9349a90b321f51f553db0243a732c615ee7ab7a45cc4a4d4d0162e65dbc271",
      "status": "draft",
      "version": "0.1.0"
    },
    {
      "id": "DAT-100",
      "path": "DAT/DAT-100.md",
      "record_sha256": "a4811a5b29ed7c2ea0a5c0cb167154f0b98aa0fe671aa9de1c794e5148eb7846",
      "status": "draft",
      "version": "0.1.0"
    },
    {
      "id": "DAT-110",
      "path": "DAT/DAT-110.md",
      "record_sha256": "dc65a6005a37949d7ab1ecfea37ea72d58cb91b04b5d5e6fad623627f080b336",
      "status": "draft",
      "version": "0.1.0"
    },
    {
      "id": "DAT-120",
      "path": "DAT/DAT-120.md",
      "record_sha256": "dace4310374c999a7253aae6f8ca534869f2de59c05a56d4a69b8931500153b3",
      "status": "draft",
      "version": "0.1.0"
    },
    {
      "id": "DAT-130",
      "path": "DAT/DAT-130.md",
      "record_sha256": "d00ee4a49e7ddcb7737f43614a64039e7910a914349bd243b0f20446d495dd2d",
      "status": "draft",
      "version": "0.1.0"
    },
    {
      "id": "DAT-140",
      "path": "DAT/DAT-140.md",
      "record_sha256": "41bfcc5bbbe6d904d0b1f6c65027714eb4bb73786e53296c50ac22b064e4361d",
      "status": "draft",
      "version": "0.1.0"
    },
    {
      "id": "DAT-150",
      "path": "DAT/DAT-150.md",
      "record_sha256": "def1a4e0bb400959d6dbd71b341c57c798b3e2bc5ec8a9822f972ac59c331a8f",
      "status": "draft",
      "version": "0.1.0"
    },
    {
      "id": "DAT-160",
      "path": "DAT/DAT-160.md",
      "record_sha256": "d2f584375be69432603a46d7c169836cfa056e8e46b1fd23ffadedd0d16dff9c",
      "status": "draft",
      "version": "0.1.0"
    },
    {
      "id": "EDU-100",
      "path": "EDU/EDU-100.md",
      "record_sha256": "b0a3075c18c054b826e5ab194f2899baaa94258dc75c0d5c25b81c485a891b4d",
      "status": "draft",
      "version": "0.1.0"
    },
    {
      "id": "EDU-110",
      "path": "EDU/EDU-110.md",
      "record_sha256": "d9cab4a9fa761e98a5e14e14f1b8b23a161f37447c0833c75233e4c1cb902219",
      "status": "draft",
      "version": "0.1.0"
    },
    {
      "id": "EDU-120",
      "path": "EDU/EDU-120.md",
      "record_sha256": "c07897b0c58248f3d017f1bc6d8934370512377825ac3ac9db33dc02886cb62f",
      "status": "draft",
      "version": "0.1.0"
    },
    {
      "id": "EDU-130",
      "path": "EDU/EDU-130.md",
      "record_sha256": "8811b2c7ce90fd6e08503e4d0a7c32dc3ede964b8967b5a1d0a10b34a8d7a8e7",
      "status": "draft",
      "version": "0.1.0"
    },
    {
      "id": "EDU-140",
      "path": "EDU/EDU-140.md",
      "record_sha256": "e84e91a906843415a42bdab4957931d1959d62ff02b104aa147896d52de23845",
      "status": "draft",
      "version": "0.1.0"
    },
    {
      "id": "GOV-100",
      "path": "GOV/GOV-100.md",